{"candidate_sha256": "fcb9ed595c54e71284243bf2e995109c0839de9ed6f715e346d0e4b545c8e24c", "checks": {"decision_usefulness": "pass", "drivers": "pass", "freshness": "pass", "market_validation": "pass", "official_policy": "pass", "pricing": "pass"}, "executive_summary": "Review of candidate fcb9ed59 (snapshot 2026-10-05): 12 drivers (3+3 per bank, up from 2+2), all 10/1-10/2 incrementals verified against live primaries/secondaries this session (Jefferson federalreserve.gov 10/1 speech text; Reuters lean-against-Oct 10/1 updated 10/2 with ~70%->~25% repricing; MPA 10/2 UBS/Manulife/Oxford/Scotia Oct-call flip with Sep CPI 3.3% fcast; FP 10/2 G7 100M-bbl release with $2.75/L diesel / $1.72/L gas). Math re-verified: Fed base -1/eff -2.5 hold (8 vs 9, decay 5d/19d/6d/3d/4d/4d), BOC base 0/eff 1.5 hold (8 vs 8, boc-d1 31d x0.25 honestly decayed). Pricing within freshness window (Fed 10-03 2d, BOC 10-02 3d, both <=4d, no stale flag); live Polymarket overlay corroborates (Fed 78/21/1, BOC 70/30/0 pulled 10-05 via fetch_betting). Prior 10-04 minors fixed: Manulife unlinked clause removed from boc-d1, linkable MPA roundup added as boc-h3. Zero structural flags. Three minors deferred to next cycle. Publish.", "findings": [{"disposition": "next_cycle", "evidence": "candidate meetings.fed.pricing.probabilities hike=0.23 vs live Polymarket hike=0.21 (Oct 5 pull) and CNBC 10/2 CME 17-18%; pricing as_of=2026-10-03 is 2d old, within the 4d machine window but 5pp above the freshest CME read.", "field": "meetings.fed.pricing.probabilities", "issue": "Fed hike prob 23% is ~5pp above the Oct 2 CME 17-18% read cited by CNBC; acceptable within window but re-pull CME next cycle", "severity": "minor"}, {"disposition": "next_cycle", "evidence": "candidate meetings.boc.pricing.as_of=2026-10-02 vs snapshot 2026-10-05 (3d gap); probabilities 0.3/0.7/0 match live Polymarket 30/70/0 pulled Oct 5, so directionally fresh but re-pull CORRA OIS next cycle.", "field": "meetings.boc.pricing.as_of", "issue": "BOC pricing 3 days old; numbers still match live betting but CORRA OIS should be re-pulled next cycle", "severity": "minor"}, {"disposition": "next_cycle", "evidence": "candidate drivers.boc.dovish[0]: weight=4, market_validation='unverified'. Carried over from 10-04 review; machine rule only mandates evidence at >=5.", "field": "drivers.boc.boc-d1.market_validation", "issue": "Weight-4 driver still carries unverified validation; attach a numeric OIS/CORRA-day anchor when available", "severity": "minor"}], "flags_dispositioned": [], "operator": "dashboard-operator", "reviewed_at": "2026-10-05T16:45:00-04:00", "reviewer": "independent-pm", "schema_version": "1.0", "snapshot_date": "2026-10-05", "verdict": "APPROVED"}