{
  "schema_version": "1.0",
  "reviewer": "independent-pm",
  "operator": "rates-decisions-writer",
  "reviewed_at": "2026-10-16T08:52:33-04:00",
  "snapshot_date": "2026-10-16",
  "candidate_sha256": "c14655c398d05829cba5779f25627b66e6b05c33fa3bfa28ba260f80e4228603",
  "verdict": "APPROVED",
  "executive_summary": "Independent review of frozen candidate c14655c398d0 (snapshot 2026-10-16; operator rates-decisions-writer). Hash chain verified: candidate.sha256 == candidate.json raw bytes == canonical sha of data/current.json = c14655c398d05829cba5779f25627b66e6b05c33fa3bfa28ba260f80e4228603; machine structural flags regenerated locally -> zero, byte-identical to the committed structural-flags.json; prior round (2026-10-14) closed with zero open findings - nothing carried. Official policy confirmed live: Fed hiked +25bp to 3.75-4.00% on Sep 16 ('approved ... by a 12-0 vote', federalreserve.gov statement live); Oct 7 minutes: all participants supported the hike, 'most participants assessed that another increase ... would likely be appropriate by year end', staff 2% return pushed to 2029; next meeting Oct 27-28 (fomccalendars). BoC held at 2.25% on Sep 2 (key-interest-rate table: 7 consecutive holds since the Oct 29, 2025 cut); next decision Oct 28 09:45 ET with MPR; BOS + Canadian Survey of Consumer Expectations Oct 19 11:30 ET (bankofcanada.ca/press/upcoming-events). Pricing matches live sources: Fed 85.1/14.9/0 vs live cluster 84-87% hold / 13-16% hike (CME FedWatch reflected at 87.3/12.7 on Oct 16; Kalshi/Polymarket 86.5; Fed funds futures 84.0; Warsh remarks cut hike odds 'below 15%' per Business Times/Bloomberg/WSJ and Straits Times '15% ... from more than 25% on Oct 15'; CNBC's 72.3% is the stale pre-Warsh read); implied 3.91 = 3.875 + 0.149 x 25bp. BoC 64/36/0 (+9bp) exact match to live BlueGamma: 'As of 16 Oct 2026, overnight index swap pricing implies a 64% probability the Bank of Canada holds ... with a market-implied move of +9 bp'. Polymarket live (gamma-api): Fed hold 86.5 / hike 13.5, volume $43.5M exact (filed liquidity $4.2M vs live ~$4.4M = live-book jitter); BoC hold 81.25 / hike 17.3, volume $182.3k exact (filed liq $66.8k vs live ~$65.4k jitter). Drivers (22; 6 new) spot-checked against primaries: BLS Sep PPI archive (1.3% m/m; 6.3% y/y largest since Dec 2022; gasoline +20.3%; 'over 80% of the broad-based rise ... final demand energy'); core ex-F/E 0.7% m/m / 5.0% y/y matches the canonical core series (CNN/TradingEconomics); BLS Sep CPI (3.7%/core 2.6%/0.6% m/m; gasoline 'over half'); Waller Oct 8 speech 'Sixteen of the 18 participants ...' matches fed-h2 16/18; Hammack Oct 12 (clevelandfed.org verbatim) + Oct 15 NY fireside ('might need to move even more'); Warsh Oct 16 CNBC quote + AP/Bloomberg Law AI field hearing Nov 16 + blackout weekend; Daly/Bowman Reuters pieces live, quotes match; Macklem Oct 16 FXStreet quote verbatim; MPA (UBS Oct+Jan to 2.75%, Sep CPI f 3.3%; Manulife/Oxford Oct+Dec; Scotia Oct; RBC 'close call'); canada.ca $27.6B counter-tariffs effective Sep 8; Financial Post G7 100M barrels / 4 months / diesel within 20 days / $2.75L record; Warsh Aug 28 Jackson Hole 'hard pressed' verified on federalreserve.gov. Market validations reproduce: fed-h6 22.1 -> ~54 -> 37.1 (Oct 13-14) and year-end >96%; fed-h7 ~30% post-PPI; fed-d4 ~30% -> below 15%; BlueGamma 63->64; Brent $106.06 Oct 14 settle / ~$104.4 Oct 15 exact. Calendar verified: StatCan 'Next release September CPI: Monday, October 19'; FOMC Oct 27-28; BoC Oct 28; BEA PCE + Q3 GDP advance Oct 29 08:30 (BEA release schedule). Math recomputed: Fed base +5 / effective +3.75 'lean hike' (band matches base; market prices an 85% hold - divergence surfaced, not averaged); BoC base 0 / effective -3.5 'hold'; mean |weight| 2.79 / 2.50; no weight >=5 (no numeric-validation gap); the one same-URL pair (boc-h1/boc-d2) carries distinct facets. Verdict: APPROVED - zero critical/major; 1 minor (quote hygiene, next cycle); no machine flags to disposition; publish.",
  "checks": {
    "official_policy": "pass",
    "pricing": "pass",
    "drivers": "pass",
    "market_validation": "pass",
    "freshness": "pass",
    "decision_usefulness": "pass"
  },
  "findings": [
    {
      "severity": "minor",
      "field": "drivers.fed.fed-h4.summary; drivers.fed.fed-d6.data.actual",
      "issue": "Two condensed quote fragments are not verbatim against their sources: fed-h4 quotes 'not sufficient progress' on inflation (minutes read 'they had not seen sufficient progress on lowering inflation'); fed-d6 opens a quote with 'No urgency for taking further action at this point' (Bowman actually said 'I don't feel any urgency for taking further action at this point'). Cosmetic for a summary product; fix in a future cycle by restoring the verbatim wording or dropping the quote marks.",
      "evidence": "https://www.federalreserve.gov/monetarypolicy/fomcminutes20260916.htm: 'participants noted that inflation remained elevated and that they had not seen sufficient progress on lowering inflation in recent months'; Reuters 2026-10-14 (US News syndication): 'I don't feel any urgency for taking further action at this point, we really need to take some time and understand how things will evolve'",
      "disposition": "next_cycle"
    }
  ],
  "flags_dispositioned": []
}
